{
  "schema": "ihat://identity/account-recovery/v1",
  "id": "recovery/account-001",
  "revision": 1,
  "created_at": "2026-08-03T01:00:00.000Z",
  "updated_at": "2026-08-03T01:00:20.000Z",
  "digest": "sha256:1e31c8c05fae4853be4fba815261613e2f7a5afc2cd28e5454dce1c1c3204aa4",
  "subject_id": "subject/person-001",
  "recovery_method": "mnemonic-seed-and-bound-authenticator",
  "authority_references": [
    "recovery-authority/offline-key-reference-001",
    "recovery-authority/operator-key-reference-002"
  ],
  "target_authenticator_ids": ["authenticator/passkey-001"],
  "ceremony_digest": "sha256:9999999999999999999999999999999999999999999999999999999999999999",
  "initiated_at": "2026-08-03T01:00:00.000Z",
  "expires_at": "2026-08-03T01:15:00.000Z",
  "status": "verified",
  "revocation_epoch": 1
}
